<?xml version="1.0" encoding="UTF-8"?>
<xs:schema xmlns:xs="http://www.w3.org/2001/XMLSchema"
	targetNamespace="http://www.example.org/prod" xmlns:tns="http://www.example.org/prod"
	elementFormDefault="qualified">

	<xs:element name="users">
		<xs:complexType>
			<xs:sequence>
				<xs:element name="user" minOccurs="1" maxOccurs="unbounded">
					<xs:complexType>
						<xs:sequence>
							<xs:element name="firstName" type="xs:string" />
							<xs:element name="lastName" type="xs:string" />
							<xs:element name="email" type="xs:string" />
							<xs:element name="contact" type="xs:string" />
							<xs:element name="address" type="xs:string" />
							<xs:element name="city" type="xs:string" />
							<xs:element name="region" type="xs:string" />
							<xs:element name="password" type="xs:string" />
							<xs:element name="cart">
								<xs:complexType>
									<xs:sequence>
										<xs:element name="product" maxOccurs="unbounded">
											<xs:complexType>
												<xs:sequence>
													<xs:element name="productID"/>
													<xs:element name="quantity"/>	
												</xs:sequence>
											</xs:complexType>
										</xs:element>
										
									</xs:sequence>
								</xs:complexType>
							</xs:element>
						</xs:sequence>
					</xs:complexType>
				</xs:element>
			</xs:sequence>
		</xs:complexType>
	</xs:element>




</xs:schema>